<?xml version="1.0" encoding="UTF-8"?>
<!DOCTYPE rutas SYSTEM "rutas.dtd">
<rutas>
    <ruta>
        <nombre>Sevilla Monumental: Paseo por el Casco Histórico y Triana</nombre>
        <tipo>Cultural y Paisajística</tipo>
        <transporte>A pie</transporte>
        <fecha>2024-04-10</fecha>
        <hora>10:00</hora>
        <duracion>4 horas</duracion>
        <agencia>Sin agencia</agencia>
        <descripcion>Un recorrido a pie por los monumentos más emblemáticos de Sevilla, atravesando el barrio de Santa Cruz, bordeando el Guadalquivir y descubriendo la esencia de Triana.</descripcion>
        <personas>Apta para todos los públicos y personas en forma física normal</personas>
        <lugarInicio>Patio de Banderas (Alcázar)</lugarInicio>
        <direccionInicio>Plaza del Patio de Banderas, s/n</direccionInicio>
        <coordenada>
            <longitud>-5.9902257</longitud>
            <latitud>37.3830519</latitud>
            <altitud>12</altitud>
        </coordenada>
        <referencias>
            <referencia>https://blog.viajesyfotos.net/sevilla-ruta-a-pie-con-mapa/</referencia>
            <referencia>https://www.visitasevilla.es/</referencia>
            <referencia>https://es.wikipedia.org/wiki/Casco_Antiguo_(Sevilla)</referencia>
        </referencias>
        <recomendacion>10</recomendacion>
        <hitos>
            <hito>
                <nombreHito>Real Alcázar de Sevilla</nombreHito>
                <descripcionHito>Palacio real de estilo mudéjar y jardines históricos.</descripcionHito>
                <coordenada>
                    <longitud>-5.9902257</longitud>
                    <latitud>37.3830519</latitud>
                    <altitud>12</altitud>
                </coordenada>
                <distanciaAnterior unidades="metros">0</distanciaAnterior>
                <galeriaFotos>
                    <foto>alcazar.jpg</foto>
                </galeriaFotos>
            </hito>

            <hito>
                <nombreHito>Hospital Los Venerables</nombreHito>
                <descripcionHito>Edificio barroco del siglo XVII en el barrio de Santa Cruz.</descripcionHito>
                <coordenada>
                    <longitud>-5.9899354</longitud>
                    <latitud>37.3851509</latitud>
                    <altitud>14</altitud>
                </coordenada>
                <distanciaAnterior unidades="metros">250</distanciaAnterior>
                <galeriaFotos>
                    <foto>venerables.jpg</foto>
                </galeriaFotos>
            </hito>

            <hito>
                <nombreHito>Catedral de Sevilla</nombreHito>
                <descripcionHito>La catedral gótica más grande del mundo y su Giralda.</descripcionHito>
                <coordenada>
                    <longitud>-5.9931068</longitud>
                    <latitud>37.3858247</latitud>
                    <altitud>11</altitud>
                </coordenada>
                <distanciaAnterior unidades="metros">350</distanciaAnterior>
                <galeriaFotos>
                    <foto>catedral.jpg</foto>
                </galeriaFotos>
            </hito>

            <hito>
                <nombreHito>Palacio de San Telmo</nombreHito>
                <descripcionHito>Sede de la Presidencia de la Junta, joya del barroco sevillano.</descripcionHito>
                <coordenada>
                    <longitud>-5.9936221</longitud>
                    <latitud>37.380243</latitud>
                    <altitud>9</altitud>
                </coordenada>
                <distanciaAnterior unidades="metros">650</distanciaAnterior>
                <galeriaFotos>
                    <foto>santelmo.jpg</foto>
                </galeriaFotos>
            </hito>

            <hito>
                <nombreHito>Real Parroquia de Señora Santa Ana</nombreHito>
                <descripcionHito>Iglesia gótico-mudéjar en el corazón del barrio de Triana.</descripcionHito>
                <coordenada>
                    <longitud>-6.0005431</longitud>
                    <latitud>37.3828228</latitud>
                    <altitud>10</altitud>
                </coordenada>
                <distanciaAnterior unidades="metros">750</distanciaAnterior>
                <galeriaFotos>
                    <foto>santaana.jpg</foto>
                </galeriaFotos>
            </hito>

            <hito>
                <nombreHito>Iglesia Colegial del Divino Salvador</nombreHito>
                <descripcionHito>Segundo templo más grande de la ciudad tras la Catedral.</descripcionHito>
                <coordenada>
                    <longitud>-5.9928375</longitud>
                    <latitud>37.3899966</latitud>
                    <altitud>15</altitud>
                </coordenada>
                <distanciaAnterior unidades="metros">1200</distanciaAnterior>
                <galeriaFotos>
                    <foto>salvador.jpg</foto>
                </galeriaFotos>
            </hito>
        </hitos>
    </ruta>

    <ruta>
        <nombre>Ruta Arqueológica de Itálica</nombre>
        <tipo>Arqueológica e Histórica</tipo>
        <transporte>A pie</transporte>
        <fecha>2024-06-12</fecha>
        <hora>10:30</hora>
        <duracion>2 horas</duracion>
        <agencia>Guías Santiponce</agencia>
        <descripcion>Recorrido por la primera ciudad romana fundada en Hispania, cuna de los emperadores Trajano y Adriano.</descripcion>
        <personas>Apta para todos los públicos y visitas escolares</personas>
        <lugarInicio>Entrada Principal Conjunto Arqueológico</lugarInicio>
        <direccionInicio>Avenida de Extremadura, s/n, Santiponce</direccionInicio>
        <coordenada>
            <longitud>-6.0445</longitud>
            <latitud>37.4440</latitud>
            <altitud>35</altitud>
        </coordenada>
        <referencias>
            <referencia>https://www.museosdeandalucia.es/web/conjuntoarqueologicodeitalica</referencia>
            <referencia>https://es.wikipedia.org/wiki/It%C3%A1lica</referencia>
            <referencia>https://www.andalucia.org/es/santiponce-turismo-cultural-italica</referencia>
        </referencias>
        <recomendacion>9</recomendacion>
        <hitos>
            <hito>
                <nombreHito>Anfiteatro Romano</nombreHito>
                <descripcionHito>Uno de los más grandes del imperio, con capacidad para 25.000 espectadores.</descripcionHito>
                <coordenada>
                    <longitud>-6.0435</longitud>
                    <latitud>37.4455</latitud>
                    <altitud>32</altitud>
                </coordenada>
                <distanciaAnterior unidades="metros">0</distanciaAnterior>
                <galeriaFotos>
                    <foto>anfiteatro.jpg</foto>
                </galeriaFotos>
            </hito>
            <hito>
                <nombreHito>Edificio de la Exedra</nombreHito>
                <descripcionHito>Complejo de carácter público con una gran zona semicircular y termas propias.</descripcionHito>
                <coordenada>
                    <longitud>-6.0465</longitud>
                    <latitud>37.4435</latitud>
                    <altitud>42</altitud>
                </coordenada>
                <distanciaAnterior unidades="metros">350</distanciaAnterior>
                <galeriaFotos>
                    <foto>exedra.jpg</foto>
                </galeriaFotos>
            </hito>
            <hito>
                <nombreHito>Casa de los Pájaros</nombreHito>
                <descripcionHito>Vivienda señorial famosa por sus mosaicos detallados que representan diversas especies de aves.</descripcionHito>
                <coordenada>
                    <longitud>-6.0478</longitud>
                    <latitud>37.4442</latitud>
                    <altitud>45</altitud>
                </coordenada>
                <distanciaAnterior unidades="metros">150</distanciaAnterior>
                <galeriaFotos>
                    <foto>pajaros.jpg</foto>
                </galeriaFotos>
            </hito>
            <hito>
                <nombreHito>Casa del Planetario</nombreHito>
                <descripcionHito>Residencia que conserva un mosaico circular con las divinidades que dan nombre a los días de la semana.</descripcionHito>
                <coordenada>
                    <longitud>-6.0485</longitud>
                    <latitud>37.4448</latitud>
                    <altitud>46</altitud>
                </coordenada>
                <distanciaAnterior unidades="metros">100</distanciaAnterior>
                <galeriaFotos>
                    <foto>planetario.jpg</foto>
                </galeriaFotos>
            </hito>
            <hito>
                <nombreHito>Termas Mayores</nombreHito>
                <descripcionHito>Centro de ocio y salud de la ciudad con restos de la palestra y salas de baño.</descripcionHito>
                <coordenada>
                    <longitud>-6.0472</longitud>
                    <latitud>37.4428</latitud>
                    <altitud>38</altitud>
                </coordenada>
                <distanciaAnterior unidades="metros">280</distanciaAnterior>
                <galeriaFotos>
                    <foto>termas.jpg</foto>
                </galeriaFotos>
            </hito>
        </hitos>
    </ruta>
    <ruta>
        <nombre>Ruta Ciclista: Del Nervión al Aljarafe</nombre>
        <tipo>Deportiva y Paisajística</tipo>
        <transporte>Bicicleta</transporte>
        <fecha>2024-05-20</fecha>
        <hora>08:30</hora>
        <duracion>3 horas</duracion>
        <agencia>Sin agencia</agencia>
        <descripcion>Ruta circular que parte del centro de Sevilla, cruza el Guadalquivir y asciende por las colinas del Aljarafe visitando Santiponce y Salteras.</descripcion>
        <personas>Personas en buena forma física</personas>
        <lugarInicio>Hospital San Juan de Dios (Nervión)</lugarInicio>